<!--	mrbcode.dtd
		Code Generator for MARaBOU
		Version 1.0
		19-Nov-2007
		R. Lutter
		Email: Rudi.Lutter@Physik.Uni-Muenchen.DE
-->

<!-- entities -->

<!-- as known form html -->
<!ENTITY amp "&#38;">
<!ENTITY gt "&#62;">
<!ENTITY lt "&#60;">

<!-- derived -->
<!ENTITY sout "&lt;&lt;">
<!ENTITY addr "&amp;">
<!ENTITY ptr "-&gt;">
<!ENTITY and "&amp;&amp;">

<!ELEMENT mrbcode (file | (code | class | method | funct | ctor | include)*)>

<!-- text with substitutions -->
<!ENTITY % stext "(#PCDATA | s | S |  m | mm | r | rm)*">
<!-- text to be used in comments: substitutions, bold/italic/underlined, boxed, and line break -->
<!ENTITY % ctext "(#PCDATA | s | S |  m | mm  | r | rm | b | i | u | bx | nl)*">

<!-- file spec -->
<!ELEMENT file (tag, slist?, fileHdr, (code | foreach)*, (class | method | funct | include)+)>

<!-- file header -->
<!ELEMENT fileHdr (xname, gname, purp?, descr?, rootClassList?, mrbClassList?, author, mail, url, version, date?)>

<!-- C++ class definition -->
<!ELEMENT class (tag?, classHdr, code)>
<!-- C++ class header -->
<!ELEMENT classHdr (cname, purp, inheritance?, argList?, descr?)>
<!-- C++ class constructor -->
<!ELEMENT ctor (tag?, ctorHdr, code)>
<!-- C++ constructor header -->
<!ELEMENT ctorHdr (cname, purp, argList?, descr?)>

<!-- C++ class method definition -->
<!ELEMENT method (tag?, methodHdr, (code | include)+)>
<!-- C++ class method header -->
<!ELEMENT methodHdr (mname, cname, purp, argList?, returnVal, descr?)>

<!-- function definition -->
<!ELEMENT funct (tag?, functHdr, (code | include)+)>
<!-- function header -->
<!ELEMENT functHdr (fname, ftype, purp, argList?, returnVal, descr?)>

<!-- include code from other file -->
<!ELEMENT include (tag?, fpath?, descr?)>

<!-- piece of code -->
<!ELEMENT code (tag?, comment?, slist?, (switch | foreach | if | code | cbody | include | nl)*)>
<!-- code body -->
<!ELEMENT cbody (switch | if | l | nl)*>

 <!-- if clause -->
<!ELEMENT if (flag, flagValue?, descr?, (cbody | include)+)>

<!-- code loop -->
<!ELEMENT foreach (tag?, comment?, item, descr?, slist?, (cbody | switch | if | include)+)>

<!-- code selection depending on tag -->
<!ELEMENT switch (item, case+)>
<!-- case: tagged piece of code -->
<!ELEMENT case (tag, descr?, (cbody | include)+)>

<!-- item -->
<!ELEMENT item (#PCDATA)>

<!-- function type -->
<!ELEMENT ftype (#PCDATA)>

<!-- argument list -->
<!ELEMENT argList (arg)+>
<!-- single argument -->
<!ELEMENT arg (aname, atype, descr?)>
<!-- argument type -->
<!ELEMENT atype %stext;>
<!-- return value (class method or function) -->
<!ELEMENT returnVal (arg)>

<!-- comment -->
<!ELEMENT comment %ctext;>

<!-- list of links referencing ROOT objects -->
<!ELEMENT rootClassList (classRef+)>
<!-- list of links referencing MARaBOU objects -->
<!ELEMENT mrbClassList (classRef+)>
<!-- inheritance list to be included in class header -->
<!ELEMENT inheritance (classRef+)>
<!-- class reference -->
<!ELEMENT classRef (cname, descr?)>

<!-- tags to mark pieces of code -->
<!ELEMENT tag (#PCDATA)>
<!-- flag to be used in if clause -->
<!ELEMENT flag (#PCDATA)>
<!-- flag value to be used in if clause -->
<!ELEMENT flagValue (#PCDATA)>

<!-- list of substitutions -->
<!ELEMENT slist (subst)+>
<!-- substitution: to be replaced by value on code generation -->
<!ELEMENT subst (sname, descr?)>

<!-- file path -->
<!ELEMENT fpath %stext;>
<!-- name of xml file -->
<!ELEMENT xname %stext;>
<!-- name of generated code file -->
<!ELEMENT gname %stext;>
<!-- class name -->
<!ELEMENT cname %stext;>
<!-- method name -->
<!ELEMENT mname %stext;>
<!-- function name -->
<!ELEMENT fname %stext;>
<!-- name of a variable-->
<!ELEMENT vname %stext;>
<!-- name of argument -->
<!ELEMENT aname %stext;>
<!-- name of substitution -->
<!ELEMENT sname %stext;>
<!-- purpose -->
<!ELEMENT purp %stext;>
<!-- description (file, class, method, etc ...) -->
<!ELEMENT descr %ctext;>
<!-- author's name -->
<!ELEMENT author %stext;>
<!-- author's mail -->
<!ELEMENT mail %stext;>
<!-- author's url -->
<!ELEMENT url %stext;>

<!-- version (cvs: $Id: mrbcode.dtd,v 1.4 2008-02-18 12:29:03 Rudolf.Lutter Exp $) -->
<!ELEMENT version (#PCDATA)>
<!-- date (cvs: $Date: 2008-02-18 12:29:03 $) -->
<!ELEMENT date (#PCDATA)>

<!-- to be substituted -->
<!ELEMENT s (#PCDATA)>
<!-- to be substituted (1st char upper case) -->
<!ELEMENT S (#PCDATA)>

<!-- line of code -->
<!ELEMENT l %stext;>

<!-- bold, italic, underline, box -->
<!ELEMENT b (#PCDATA)>
<!ELEMENT i (#PCDATA)>
<!ELEMENT u (#PCDATA)>
<!ELEMENT bx (#PCDATA)>

<!-- newline -->
<!ELEMENT nl EMPTY>

<!-- root and marabou links -->
<!ELEMENT r (#PCDATA)>
<!ELEMENT m (#PCDATA)>
<!ELEMENT rm (#PCDATA)>
<!ELEMENT mm (#PCDATA)>

<!-- attribut lists -->

<!-- mrbcode -->
<!ATTLIST  mrbcode
   type    (contiguous|selective) "contiguous"
>

<!-- indentation -->
<!ATTLIST  class
    indent    CDATA    "0"
>
<!ATTLIST  method
    indent    CDATA    "0"
>
<!ATTLIST  funct
    indent    CDATA    "0"
>
<!ATTLIST  code
    indent    CDATA    "0"
>

<!ATTLIST  switch
    indent    CDATA    "0"
>
<!ATTLIST  foreach
    indent    CDATA    "0"
>
<!ATTLIST  if
    indent    CDATA    "0"
>
<!ATTLIST  cbody
    indent    CDATA    "0"
>

<!ATTLIST  include
    indent    CDATA    "0"
>

<!-- comment -->
<!ATTLIST comment
    type    (code|doc) "code"
 >
 
<!-- slist -->
<!ATTLIST slist
    type    (global|local) "global"
 >
 
<!-- tag -->
<!ATTLIST tag
    type    (root|local) "local"
 >
 
 <!-- inheritance type -->
<!ATTLIST inheritance
    type    (root|mrb) #REQUIRED
 >
 
<!-- r (root) and m (marabou) class refs -->
<!ATTLIST r
    class CDATA #IMPLIED
 >
<!ATTLIST m
    class CDATA #IMPLIED
 >
<!-- r (root) and m (marabou) method refs -->
<!ATTLIST rm
    class CDATA #REQUIRED
 >
<!ATTLIST mm
    class CDATA #REQUIRED
 >
 
